{
  "$schema": "../../../../../schemas/animation.schema.json",
  "id": "black-x",
  "palette": {
    ".": "000000",
    "W": "FFFFFF"
  },
  "fps": 2,
  "loop": true,
  "frames": [
    ["W......W", ".W....W.", "..W..W..", "...WW...", "...WW...", "..W..W..", ".W....W.", "W......W"],
    ["........", "........", "........", "........", "........", "........", "........", "........"]
  ]
}
