{
  "$schema": "../../../../../schemas/animation.schema.json",
  "id": "black",
  "palette": {
    ".": "000000",
    "W": "FFFFFF"
  },
  "fps": 2,
  "loop": true,
  "frames": [
    ["WWWWWWWW", "W......W", "W......W", "W......W", "W......W", "W......W", "W......W", "WWWWWWWW"],
    ["........", "........", "........", "........", "........", "........", "........", "........"]
  ]
}
